{
  "athlete_id": "test_athlete_threshold",
  "profile_date": "2026-01-20",
  "current_state": {
    "sleep_hours": 8.0,
    "sleep_consistency": 0.8,
    "injury_status": false,
    "stress_level": "low",
    "weekly_volume_hours": 12.0,
    "volume_consistency_weeks": 10,
    "recent_illness": false,
    "hrv_trend": "stable",
    "current_fitness_level": "intermediate"
  },
  "training_history": {
    "years_training": 3,
    "longest_run_km": 25,
    "longest_ride_km": 100,
    "longest_swim_meters": 3000
  },
  "goals": {
    "primary_goal": "race_performance",
    "race_date": "2026-04-20",
    "race_distance": "olympic",
    "weeks_to_race": 12,
    "target_finish_time_minutes": 150
  },
  "constraints": {
    "available_training_days": 6,
    "max_session_duration_hours": 2.5,
    "equipment_access": {
      "pool_access": true,
      "bike_trainer": true,
      "power_meter": true,
      "heart_rate_monitor": true
    }
  },
  "preferences": {
    "preferred_intensity_distribution": "threshold",
    "long_workout_day": "saturday",
    "rest_day": "sunday",
    "preferred_training_time": "morning"
  }
}
