{
  "athlete_id": "test_athlete_001",
  "profile_date": "2026-01-19",
  "current_state": {
    "sleep_hours": 8.0,
    "sleep_consistency": 0.4,
    "injury_status": false,
    "stress_level": "low",
    "weekly_volume_hours": 10.0,
    "volume_consistency_weeks": 6,
    "resting_heart_rate": 52,
    "hrv_trend": "stable",
    "recent_illness": false
  },
  "training_history": {
    "years_training": 3,
    "recent_races": [
      {
        "date": "2025-09-15",
        "distance": "olympic",
        "finish_time": "2:45:30"
      }
    ],
    "injury_history": []
  },
  "goals": {
    "primary_goal": "race_performance",
    "race_date": "2026-04-12",
    "race_distance": "olympic",
    "goal_finish_time": "2:35:00",
    "weeks_to_race": 12,
    "priority_level": "A"
  },
  "constraints": {
    "available_training_days": 6,
    "max_session_duration_hours": 2.5,
    "equipment_access": {
      "pool_access": true,
      "bike_trainer": true,
      "power_meter": false,
      "heart_rate_monitor": true
    },
    "environmental_factors": {
      "climate": "temperate",
      "altitude_meters": 0
    }
  },
  "preferences": {
    "preferred_intensity_distribution": "polarized",
    "long_workout_day": "saturday",
    "rest_day": "monday"
  },
  "metadata": {
    "created_at": "2026-01-19T10:00:00Z",
    "notes": "Test case: Happy path - all assumptions satisfied"
  }
}